country,supermarket,product_category,product_name,normalized_price,is_outlier
Russia,Lenta,black_tea,"Чай черный КРАСНОДАРСКИЙ ГОСТ ЧАЙ РУЧНОЙ СБОР с бергамотом байховый, листовой, 100г (100г)",22.7742544,False
Russia,Lenta,black_tea,"Чай черный AKBAR Голд байховый цейлонский, крупнолистовой, 250г (250г)",24.61021376,False
Russia,Lenta,black_tea,"Чай черный КРАСНОДАРСКИЙ ГОСТ ЧАЙ РУЧНОЙ СБОР байховый, листовой, 40г (40г)",31.506836,False
Russia,Lenta,black_tea,"Чай черный GREENFIELD Спринг Мелоди байховый, листовой, 100г (100г)",20.8947344,False
Russia,Lenta,black_tea,"Чай черный АЗЕРЧАЙ с ароматом бергамота, 25пак (25пак)",25.3690976,False
Russia,Lenta,black_tea,"Чай черный GREENFIELD Кениан санрайз, 100г (100г)",23.391179199999996,False
Russia,Lenta,black_tea,"Чай черный AKBAR крупнолистовой, 100г (100г)",24.3220944,False
Russia,Lenta,black_tea,"Чай черный DILMAH Golden pekoe цейлонский, листовой, 100г (100г)",34.9126368,False
Russia,Lenta,black_tea,"Чай черный DILMAH цейлонский со вкусом бергамота и ванили, листовой, 100г (100г)",30.2591664,False
Russia,Lenta,black_tea,"Чай черный НЕОБЫЧАЙНЫЙ цейлонский, листовой, 400г (400г)",13.294563599999998,False
Russia,Lenta,black_tea,"Чай черный НЕОБЫЧАЙНЫЙ Цейлонский с ароматом бергамота, крупнолистовой, 200г (200г)",18.1589272,False
Russia,Lenta,black_tea,"Чай черный HYSON Маракуйя цейлонский c ароматом маракуйи и растительными компонентами, листовой, 100г (100г)",37.2465584,False
Russia,Lenta,black_tea,"Чай черный HYSON Фруктовая фантазия цейлонский c ароматом вишни и растительными компонентами, листовой, 100г (100г)",37.2465584,False
Russia,Lenta,black_tea,"Чай черный HYSON Саусеп цейлонский c ароматом саусепа и растительными компонентами, листовой, 100г (100г)",37.2465584,False
Russia,Lenta,black_tea,"Чай черный ЛЕНТА PREMIUM с чабрецом, 400г (400г)",16.0032836,False
Russia,Lenta,black_tea,"Чай черный ЛЕНТА PREMIUM Эрл Грей, 400г (400г)",12.512351599999999,False
Russia,Lenta,black_tea,"Чай черный ЛЕНТА PREMIUM Английский завтрак, 400г (400г)",12.512351599999999,False
Russia,Lenta,black_tea,"Чай черный ШАХ Gold байховый цейлонский, листовой, 200г (200г)",33.985591199999995,False
Russia,Lenta,black_tea,"Чай черный ПРИНЦЕССА КАНДИ Медиум, 250г (250г)",10.799500799999999,False
Russia,Lenta,black_tea,Чай черный АЗЕРЧАЙ Байховый с аром. бергамота к/уп (250г),15.73401472,False
Russia,Lenta,black_tea,Чай черный HILLTOP Цейлонское утро к/уп (50г),61.21486079999999,False
Russia,Lenta,black_tea,"Чай черный ТРИ ДРУЖНЫХ СЛОНА, 100пак (100пак)",17.980372799999998,False
Russia,Lenta,black_tea,"Чай черный SHENNUN Китайский с бергамотом, 200г (200г)",17.980372799999998,False
Russia,Lenta,black_tea,"Чай черный RICHARD Royal English Breakfast листовой, 180г (180г)",26.89617688888889,False
Russia,Lenta,black_tea,"Чай черный RICHARD Royal Kenya листовой, 180г (180г)",26.89617688888889,False
Russia,Lenta,black_tea,"Чай черный BERNLEY Инглиш Классик Цейлонский, листовой, 100г (100г)",23.391179199999996,False
Russia,Lenta,black_tea,"Чай черный ЗЕЛЕНАЯ ПАНДА Праздничный, листовой, 100г ()",29.9053744,False
Russia,Lenta,black_tea,"Чай черный TEATALE Мелодия Рождества Снеговик, листовой, 50г (50г)",29.9595488,False
Russia,Lenta,black_tea,"Чай черный ЗАВТРАК ИМПЕРАТОРА байховый цейлонский, листовой, 100г (100г)",18.042286400000002,False
Russia,Lenta,black_tea,"Чай черный ЗОЛОТАЯ ЧАША Индийский байховый, 20пак (20пак)",18.423595555555554,False
Russia,Lenta,black_tea,"Чай черный RICHE NATUR Bohemia с ароматом бергамота и айвы, листовой, 100г (100г)",80.6502032,True
Russia,Lenta,black_tea,"Чай черный RICHE NATUR Felicity с цукатами ананаса и ароматом земляники, листовой, 100г (100г)",80.6502032,True
Russia,Lenta,black_tea,"Чай черный RICHE NATUR Paradise с цукатами и ароматом манго и карамболы, листовой, 100г (100г)",80.6502032,True
Russia,Lenta,black_tea,"Чай черный CURTIS Perfect Brunch, 100саш (100саш)",30.403349647058825,False
Russia,Lenta,black_tea,"Чай черный TEATALE Сочные фрукты с ароматом бергамота, 100г (100г)",39.1371344,False
Russia,Lenta,black_tea,"Чай черный TEATALE Сочные фрукты с ароматом апельсина и манго, 100г (100г)",38.407438400000004,False
Russia,Lenta,black_tea,"Чай черный TEATALE Сочные фрукты с ароматом ананаса, 100г (100г)",38.4041216,False
Russia,Lenta,black_tea,"Чай черный ЛЕНТА Русский музей Земляника со сливками крупный листовой, 400г (400г)",14.549419599999998,False
Russia,Lenta,black_tea,"Чай черный RICHARD Energy Tea, 20пак (20пак)",60.925063529411766,False
Russia,Lenta,black_tea,"Чай черный NADIN Гранат, розмарин с ароматом граната, листовой, 100г (100г)",23.216494400000002,False
Russia,Lenta,black_tea,"Чай черный МАСТЕР ТИМ Все в шоколаде, 24пак (48г)",49.86486333333334,False
Russia,Lenta,black_tea,"Чай черный RICHARD Royal Postcards Tea Assortment Зима ассорти, 17,1г (17,1г)",130.5965754385965,True
Russia,Lenta,black_tea,"Чай черный CURTIS Summer Vibe c чабрецом, мятой и ароматом цитрусовых,  100пак (100пак)",22.111262933333332,False
Russia,Lenta,black_tea,"Чай черный WILLIAMS Black Crystal Премиум Пеко байховый цейлонский элитный, листовой, 100г (100г)",23.9351344,False
Russia,Lenta,black_tea,"Чай черный WILLIAMS Violet Crystal байховый листовой с лепестками василька, шиповником и ароматом и кусочками манго, листовой, 100г (100г)",23.9351344,False
Russia,Lenta,black_tea,"Чай черный WILLIAMS Azure Crystal цейлонский с лепестками подсолнечника и натуральными кусочками земляники, листовой, 100г (100г)",23.9351344,False
Russia,Lenta,black_tea,"Чай черный WILLIAMS Purple Crystal байховый листовой с лепестками календулы и ароматом тропических фруктов, листовой, 100г (100г)",23.9351344,False
Russia,Lenta,black_tea,"Чай черный WILLIAMS Assam Crystal индийский ассам с высоким содержанием чайных почек, листовой, 100г (100г)",23.9351344,False
Russia,Lenta,black_tea,"Чай черный TEATALE Christmas Time байховый с ароматом сливы среднелистовой, 50г (50г)",29.9595488,False
Russia,Lenta,black_tea,"Чай черный WILLIAMS Bright Crystal OPA отборный цейлонский, крупнолистовой, 100г (100г)",23.9351344,False
Russia,Lenta,black_tea,"Чай черный TEATONE с ароматом барбариса, 15пак (15пак)",94.58612740740742,True
Russia,Lenta,black_tea,"Чай черный BASILUR Винтажные цветы Жасминовая мечта, листовой, 75г (75г)",57.41307093333333,False
Russia,Lenta,black_tea,"Чай черный NADIN с чабрецом, крупнолистовой, 50г (50г)",23.989308800000003,False
Russia,Lenta,black_tea,"Чай черный ВЫБОР СЕМЬИ с чабрецом, 100пак (100пак)",8.014985777777778,False
Russia,Lenta,black_tea,"Чай черный ВЫБОР СЕМЬИ с ароматом Бергамота, среднелистовой, 100г (100г)",10.2256944,False
Russia,Lenta,black_tea,"Чай черный ВЫБОР СЕМЬИ с чабрецом, среднелистовой, 100г (100г)",10.115134399999999,False
Russia,Lenta,black_tea,"Чай черный ВЫБОР СЕМЬИ с мятой, среднелистовой, 100г (100г)",10.115134399999999,False
Russia,Lenta,black_tea,"Чай черный ЛЕНТА крупнолистовой, 200г (200г)",10.4750072,False
Russia,Lenta,black_tea,"Чай черный JOLLY в пакетиках для разовой заварки, 100пак (100пак)",17.456871200000002,False
Russia,Lenta,black_tea,"Чай черный ВЫБОР СЕМЬИ байховый гранулированный, 180г (180г)",7.112079111111112,True
Russia,Lenta,black_tea,"Чай черный ВЫБОР СЕМЬИ байховый гранулированный, 100г (100г)",8.1471664,False
Russia,Lenta,black_tea,"Чай черный AKBAR Сливочная карамель, листовой, 100г (100г)",60.2839456,False
Russia,Lenta,black_tea,"Чай черный AKBAR Грейпфрут и арбуз, листовой, 100г (100г)",60.2839456,False
Russia,Lenta,black_tea,"Чай черный AKBAR Смородина и мята, листовой, 100г (100г)",60.2839456,False
Russia,Lenta,black_tea,"Чай черный RICHARD Royal Moro orange&Passion flower, 25пак (25пак)",52.84768,False
Russia,Lenta,black_tea,"Чай черный CURTIS Perfect Brunch листовой, 100г (100г)",25.136921599999997,False
Russia,Lenta,black_tea,"Чай черный CURTIS Tender Moments листовой, 100г (100г)",26.067836800000002,False
Russia,Lenta,black_tea,"Чай черный KIOKO с ароматом бергамота, 25пак (25пак)",75.877328,False
Russia,Lenta,black_tea,"Чай черный ЛИСМА Садовые ягоды с чабрецом, 25пак (25пак)",17.68665173333333,False
Russia,Lenta,black_tea,"Чай черный IN-STICK Top choice Ассорти 3 Апельсин-миндаль, трюфель-какао, амаретто, 12пак (12пак)",58.18680666666666,False
Russia,Lenta,black_tea,"Чай черный NADIN С Праздником, крупнолистовой, 50г (50г)",34.271388800000004,False
Russia,Lenta,black_tea,"Чай черный NADIN Счастливого Нового года! крупнолистовой, 50г (50г)",34.271388800000004,False
Russia,Lenta,black_tea,"Чай черный МАЙСКИЙ Новогодний медальон, листовой, 20г (20г)",119.67567199999999,True
Russia,Lenta,black_tea,"Чай черный TEATALE Новогодняя мечта Бодрящий бергамот, 50г (50г)",29.9595488,False
Russia,Lenta,black_tea,"Чай черный TEATALE Мелодия Рождества Варежки, 50г (50г)",29.9595488,False
Russia,Lenta,black_tea,"Чай черный TEATALE Время подарков, 50г (50г)",29.9595488,False
Russia,Lenta,black_tea,"Чай черный ВКУСЫ МИРА Праздничный апельсин, листовой, 50г (50г)",53.9510688,False
Russia,Lenta,black_tea,"Чай черный ВКУСЫ МИРА Альпийский глинтвейн, листовой, 50г (50г)",53.9510688,False
Russia,Lenta,black_tea,"Чай черный ЛЕНТА Русские узоры с ароматом клубника со сливками, 20пир (20пир)",80.84423600000001,True
Russia,Lenta,black_tea,"Чай черный ЛЕНТА Русские узоры Клубника со сливками, листовой, 85г (85г)",49.29545223529412,False
Russia,Lenta,black_tea,"Чай черный ЛЕНТА Русские узоры с облепихой и грушей, листовой, 85г (85г)",49.29545223529412,False
Russia,Lenta,black_tea,"Чай черный ЛЕНТА Апельсиновый новый год ароматизированный с добавками растительного сырья, 20г (20г)",145.46931999999998,True
Russia,Lenta,black_tea,"Чай черный TEATALE Garden Flowers Purple байховый с чабрецом, среднелистовой, 50г (50г)",32.3520672,False
Russia,Lenta,black_tea,"Чай черный TEATALE Garden Flowers Pink с лесными ягодами байховый, среднелистовой, 50г (50г)",32.3520672,False
Russia,Lenta,black_tea,"Чай черный МАЙСКИЙ Ароматный бергамот, 25пак (25пак)",28.860582400000002,False
Russia,Lenta,black_tea,"Чай черный AKBAR Gold цейлонский крупнолистовой, 100г (100г)",32.3531728,False
Russia,Lenta,black_tea,"Чай черный ПРИНЦЕССА НУРИ Высокогорный листовой, 100г (100г)",14.4380304,False
Russia,Lenta,black_tea,"Чай черный ШАХ ГОЛД Индийский, 25пак (25пак)",23.524956800000002,False
Russia,Lenta,black_tea,"Чай черный BONVIDA Английский Завтрак для заваривания в 
чайнике, 20пак (20пак)",41.0719344,False
